{
  "$schema": "https://json-schema.org/draft/2020-12/schema",
  "$id": "https://example.invalid/tsunami/schemas/dataset_manifest/1.0.0/dataset_manifest.schema.json",
  "tsunami_schema": "tsunami.dataset_manifest",
  "title": "Tsunami Barrier Studio G1 Dataset Manifest",
  "type": "object",
  "additionalProperties": false,
  "required": ["schema_version", "policy_version", "manifest", "providers", "licences", "datasets", "processes", "extensions"],
  "properties": {
    "schema_version": {"type": "string", "const": "1.0.0"},
    "policy_version": {"type": "string", "const": "0.1"},
    "manifest": {"$ref": "#/$defs/manifest_identity"},
    "providers": {"type": "array", "minItems": 1, "items": {"$ref": "#/$defs/provider"}},
    "licences": {"type": "array", "minItems": 1, "items": {"$ref": "#/$defs/licence"}},
    "datasets": {"type": "array", "minItems": 1, "items": {"$ref": "#/$defs/dataset"}},
    "processes": {"type": "array", "items": {"$ref": "#/$defs/process"}},
    "extensions": {"$ref": "#/$defs/extensions"}
  },
  "$defs": {
    "logical_id": {"type": "string", "pattern": "^[a-z0-9]+(?:[._-][a-z0-9]+)*$", "maxLength": 128},
    "timestamp": {"type": "string", "pattern": "^\\d{4}-\\d{2}-\\d{2}T\\d{2}:\\d{2}:\\d{2}Z$"},
    "date": {"type": ["string", "null"], "pattern": "^\\d{4}-\\d{2}-\\d{2}$"},
    "uri": {"type": ["string", "null"], "pattern": "^[A-Za-z][A-Za-z0-9+.-]*:.+"},
    "extensions": {"type": "object"},
    "manifest_identity": {
      "type": "object",
      "additionalProperties": false,
      "required": ["manifest_id", "manifest_revision", "case_id", "case_revision", "created_at_utc", "created_by"],
      "properties": {
        "manifest_id": {"$ref": "#/$defs/logical_id"},
        "manifest_revision": {"type": "integer", "minimum": 1},
        "case_id": {"$ref": "#/$defs/logical_id"},
        "case_revision": {"type": "integer", "minimum": 1},
        "created_at_utc": {"$ref": "#/$defs/timestamp"},
        "created_by": {"type": "string", "minLength": 1}
      }
    },
    "provider": {
      "type": "object",
      "additionalProperties": false,
      "required": ["provider_id", "name", "organisation", "homepage_uri", "extensions"],
      "properties": {
        "provider_id": {"$ref": "#/$defs/logical_id"},
        "name": {"type": "string", "minLength": 1},
        "organisation": {"type": ["string", "null"], "minLength": 1},
        "homepage_uri": {"$ref": "#/$defs/uri"},
        "extensions": {"$ref": "#/$defs/extensions"}
      }
    },
    "licence": {
      "type": "object",
      "additionalProperties": false,
      "required": ["licence_id", "name", "expression", "licence_uri", "attribution", "extensions"],
      "properties": {
        "licence_id": {"$ref": "#/$defs/logical_id"},
        "name": {"type": "string", "minLength": 1},
        "expression": {"type": "string", "minLength": 1},
        "licence_uri": {"$ref": "#/$defs/uri"},
        "attribution": {"type": ["string", "null"], "minLength": 1},
        "extensions": {"$ref": "#/$defs/extensions"}
      }
    },
    "source": {
      "type": "object",
      "additionalProperties": false,
      "required": ["source_uri", "accessed_at_utc", "source_version", "publication_date"],
      "properties": {
        "source_uri": {"type": "string", "pattern": "^[A-Za-z][A-Za-z0-9+.-]*:.+"},
        "accessed_at_utc": {"$ref": "#/$defs/timestamp"},
        "source_version": {"type": ["string", "null"], "minLength": 1},
        "publication_date": {"$ref": "#/$defs/date"}
      }
    },
    "location": {
      "type": "object",
      "additionalProperties": false,
      "required": ["kind", "managed_path", "external_uri"],
      "properties": {
        "kind": {"enum": ["managed_path", "external_uri"]},
        "managed_path": {"type": ["string", "null"]},
        "external_uri": {"$ref": "#/$defs/uri"}
      }
    },
    "digest": {
      "type": "object",
      "additionalProperties": false,
      "required": ["algorithm", "value", "origin"],
      "properties": {
        "algorithm": {"const": "sha256"},
        "value": {"type": "string", "pattern": "^[0-9a-f]{64}$"},
        "origin": {"enum": ["provider_declared", "project_computed"]}
      }
    },
    "asset": {
      "type": "object",
      "additionalProperties": false,
      "required": ["asset_id", "role", "location", "media_type", "byte_size", "digest"],
      "properties": {
        "asset_id": {"$ref": "#/$defs/logical_id"},
        "role": {"enum": ["primary", "metadata", "auxiliary"]},
        "location": {"$ref": "#/$defs/location"},
        "media_type": {"type": "string", "pattern": "^[^/]+/[^/]+$"},
        "byte_size": {"type": ["integer", "null"], "minimum": 1},
        "digest": {"$ref": "#/$defs/digest"}
      }
    },
    "spatial_reference": {
      "type": "object",
      "additionalProperties": false,
      "required": ["applicability", "horizontal_crs", "vertical_datum", "horizontal_unit", "vertical_unit", "axis_order", "vertical_positive"],
      "properties": {
        "applicability": {"enum": ["spatial", "not_applicable"]},
        "horizontal_crs": {"type": ["string", "null"], "minLength": 1},
        "vertical_datum": {"type": ["string", "null"], "minLength": 1},
        "horizontal_unit": {"type": ["string", "null"], "minLength": 1},
        "vertical_unit": {"type": ["string", "null"], "minLength": 1},
        "axis_order": {"type": ["string", "null"], "minLength": 1},
        "vertical_positive": {"type": ["string", "null"], "minLength": 1}
      }
    },
    "spatial_resolution": {
      "type": "object",
      "additionalProperties": false,
      "required": ["kind", "x", "y", "unit", "description"],
      "properties": {
        "kind": {"enum": ["grid_spacing", "nominal", "irregular", "not_reported", "not_applicable"]},
        "x": {"type": ["number", "null"], "exclusiveMinimum": 0},
        "y": {"type": ["number", "null"], "exclusiveMinimum": 0},
        "unit": {"type": ["string", "null"], "minLength": 1},
        "description": {"type": ["string", "null"], "minLength": 1}
      }
    },
    "temporal_resolution": {
      "type": "object",
      "additionalProperties": false,
      "required": ["kind", "value", "unit", "description"],
      "properties": {
        "kind": {"enum": ["static_dataset", "interval", "irregular", "not_reported", "not_applicable"]},
        "value": {"type": ["number", "null"], "exclusiveMinimum": 0},
        "unit": {"type": ["string", "null"], "minLength": 1},
        "description": {"type": ["string", "null"], "minLength": 1}
      }
    },
    "resolution": {
      "type": "object",
      "additionalProperties": false,
      "required": ["spatial", "temporal"],
      "properties": {
        "spatial": {"$ref": "#/$defs/spatial_resolution"},
        "temporal": {"$ref": "#/$defs/temporal_resolution"}
      }
    },
    "uncertainty_measure": {
      "type": "object",
      "additionalProperties": false,
      "required": ["quantity", "value", "unit", "confidence_level", "method"],
      "properties": {
        "quantity": {"type": "string", "minLength": 1},
        "value": {"type": "number"},
        "unit": {"type": "string", "minLength": 1},
        "confidence_level": {"type": ["number", "null"], "exclusiveMinimum": 0, "maximum": 1},
        "method": {"type": ["string", "null"], "minLength": 1}
      }
    },
    "uncertainty": {
      "type": "object",
      "additionalProperties": false,
      "required": ["status", "measures", "description"],
      "properties": {
        "status": {"enum": ["reported", "estimated", "not_reported", "not_applicable"]},
        "measures": {"type": "array", "items": {"$ref": "#/$defs/uncertainty_measure"}},
        "description": {"type": ["string", "null"], "minLength": 1}
      }
    },
    "dataset": {
      "type": "object",
      "additionalProperties": false,
      "required": ["dataset_id", "origin_kind", "representation", "roles", "title", "description", "provider_id", "licence_id", "source", "generated_by_process_id", "assets", "spatial_reference", "resolution", "uncertainty", "citation", "extensions"],
      "properties": {
        "dataset_id": {"$ref": "#/$defs/logical_id"},
        "origin_kind": {"enum": ["source", "generated"]},
        "representation": {"enum": ["raster", "vector", "point_series", "table", "multidimensional", "other"]},
        "roles": {"type": "array", "minItems": 1, "items": {"enum": ["bathymetry", "topography", "earthquake_displacement", "prescribed_surface", "manning", "coriolis", "observation", "auxiliary"]}},
        "title": {"type": "string", "minLength": 1},
        "description": {"type": ["string", "null"], "minLength": 1},
        "provider_id": {"$ref": "#/$defs/logical_id"},
        "licence_id": {"$ref": "#/$defs/logical_id"},
        "source": {"anyOf": [{"$ref": "#/$defs/source"}, {"type": "null"}]},
        "generated_by_process_id": {"type": ["string", "null"], "pattern": "^[a-z0-9]+(?:[._-][a-z0-9]+)*$"},
        "assets": {"type": "array", "minItems": 1, "items": {"$ref": "#/$defs/asset"}},
        "spatial_reference": {"$ref": "#/$defs/spatial_reference"},
        "resolution": {"$ref": "#/$defs/resolution"},
        "uncertainty": {"$ref": "#/$defs/uncertainty"},
        "citation": {"type": ["string", "null"], "minLength": 1},
        "extensions": {"$ref": "#/$defs/extensions"}
      }
    },
    "software": {
      "type": "object",
      "additionalProperties": false,
      "required": ["name", "version", "repository_uri", "commit_sha"],
      "properties": {
        "name": {"type": "string", "minLength": 1},
        "version": {"type": "string", "minLength": 1},
        "repository_uri": {"$ref": "#/$defs/uri"},
        "commit_sha": {"type": ["string", "null"], "pattern": "^[0-9a-f]{7,64}$"}
      }
    },
    "process": {
      "type": "object",
      "additionalProperties": false,
      "required": ["process_id", "operation", "executed_at_utc", "software", "parameters", "input_dataset_ids", "output_dataset_ids", "extensions"],
      "properties": {
        "process_id": {"$ref": "#/$defs/logical_id"},
        "operation": {"$ref": "#/$defs/logical_id"},
        "executed_at_utc": {"$ref": "#/$defs/timestamp"},
        "software": {"$ref": "#/$defs/software"},
        "parameters": {"type": "object"},
        "input_dataset_ids": {"type": "array", "minItems": 1, "items": {"$ref": "#/$defs/logical_id"}},
        "output_dataset_ids": {"type": "array", "minItems": 1, "items": {"$ref": "#/$defs/logical_id"}},
        "extensions": {"$ref": "#/$defs/extensions"}
      }
    }
  }
}
